{
  "schemaVersion": 1,
  "template": "overview-a",
  "title": "仙人山服务区 · 总览(里程碑 A)",
  "widgets": [
    {
      "id": "banner-alarms",
      "slot": "banner",
      "type": "alarm-list",
      "props": { "title": "实时告警", "compact": true, "maxRows": 5 },
      "bindings": {
        "alarms": {
          "mode": "alarm",
          "entity": { "type": "DEVICE", "id": "c1cd0ab0-528e-11f1-90ba-53cf2ab0fe96", "name": "PDR1_LP1_IED1" }
        }
      }
    },
    {
      "id": "kpi-p",
      "slot": "s1",
      "type": "number-card",
      "props": {
        "title": "进线有功",
        "subtitle": "ACTIVE POWER",
        "unit": "kW",
        "decimals": 1,
        "sub": "SSP1_GP1_IED1 · P"
      },
      "bindings": {
        "value": {
          "mode": "ts",
          "entity": { "type": "DEVICE", "id": "bafa3730-528e-11f1-90ba-53cf2ab0fe96", "name": "SSP1_GP1_IED1" },
          "key": "P"
        }
      }
    },
    {
      "id": "kpi-uab",
      "slot": "s2",
      "type": "number-card",
      "props": {
        "title": "线电压 Uab",
        "subtitle": "LINE VOLTAGE",
        "unit": "V",
        "decimals": 1,
        "sub": "SSP1_GP1_IED1 · Uab"
      },
      "bindings": {
        "value": {
          "mode": "ts",
          "entity": { "type": "DEVICE", "id": "bafa3730-528e-11f1-90ba-53cf2ab0fe96", "name": "SSP1_GP1_IED1" },
          "key": "Uab"
        }
      }
    },
    {
      "id": "kpi-f",
      "slot": "s3",
      "type": "gauge",
      "props": { "title": "频率", "unit": "Hz", "min": 49, "max": 51, "decimals": 2, "color": "#199e70" },
      "bindings": {
        "value": {
          "mode": "ts",
          "entity": { "type": "DEVICE", "id": "bafa3730-528e-11f1-90ba-53cf2ab0fe96", "name": "SSP1_GP1_IED1" },
          "key": "F"
        }
      }
    },
    {
      "id": "kpi-cb",
      "slot": "s4",
      "type": "status-light",
      "props": {
        "title": "进线断路器",
        "subtitle": "CB",
        "onValue": "1",
        "onLabel": "合闸",
        "offLabel": "分闸",
        "sub": "SSP1_GP1_IED1 · CB"
      },
      "bindings": {
        "state": {
          "mode": "ts",
          "entity": { "type": "DEVICE", "id": "bafa3730-528e-11f1-90ba-53cf2ab0fe96", "name": "SSP1_GP1_IED1" },
          "key": "CB"
        }
      }
    },
    {
      "id": "chart-p-24h",
      "slot": "g1",
      "type": "line",
      "props": { "title": "进线 / 光伏功率", "subtitle": "24H · 5 分钟均值", "unit": "kW", "chartStyle": "area" },
      "bindings": {
        "series": [
          {
            "mode": "ts-history",
            "entity": { "type": "DEVICE", "id": "bafa3730-528e-11f1-90ba-53cf2ab0fe96", "name": "SSP1_GP1_IED1" },
            "keys": ["P"],
            "window": "24h",
            "agg": "AVG"
          },
          {
            "mode": "ts-history",
            "entity": { "type": "DEVICE", "id": "c27e0b30-528e-11f1-90ba-53cf2ab0fe96", "name": "PDR1_PGC1_METER1" },
            "keys": ["P"],
            "window": "24h",
            "agg": "AVG"
          }
        ]
      }
    },
    {
      "id": "chart-pq-2h",
      "slot": "g2",
      "type": "dual-axis",
      "props": { "title": "DP1 低压总进线 有功 / 无功", "unitL": "kW", "unitR": "kvar" },
      "bindings": {
        "primary": {
          "mode": "ts-history",
          "entity": { "type": "DEVICE", "id": "09db79a0-68af-11f1-88d4-69fd056ef03f", "name": "SSP1_DP1_IED1" },
          "keys": ["P"],
          "window": "2h"
        },
        "secondary": {
          "mode": "ts-history",
          "entity": { "type": "DEVICE", "id": "09db79a0-68af-11f1-88d4-69fd056ef03f", "name": "SSP1_DP1_IED1" },
          "keys": ["Q"],
          "window": "2h"
        }
      }
    },
    {
      "id": "table-currents",
      "slot": "g3",
      "type": "table",
      "props": {
        "title": "间隔 8 出线柜 三相电流",
        "mode": "latest",
        "columns": [
          { "label": "Ia", "unit": "A", "decimals": 1 },
          { "label": "Ib", "unit": "A", "decimals": 1 },
          { "label": "Ic", "unit": "A", "decimals": 1 }
        ]
      },
      "bindings": {
        "rows": [
          {
            "mode": "ts",
            "entity": { "type": "DEVICE", "id": "bd1d6550-528e-11f1-90ba-53cf2ab0fe96", "name": "SSP1_GP8_IED1" },
            "key": "Ia"
          },
          {
            "mode": "ts",
            "entity": { "type": "DEVICE", "id": "bd1d6550-528e-11f1-90ba-53cf2ab0fe96", "name": "SSP1_GP8_IED1" },
            "key": "Ib"
          },
          {
            "mode": "ts",
            "entity": { "type": "DEVICE", "id": "bd1d6550-528e-11f1-90ba-53cf2ab0fe96", "name": "SSP1_GP8_IED1" },
            "key": "Ic"
          }
        ]
      }
    },
    {
      "id": "overview-pv-ats",
      "slot": "g4",
      "type": "overview-card",
      "props": {
        "title": "光伏并网 / 南区 ATS",
        "items": [
          { "label": "光伏并网功率", "unit": "kW" },
          { "label": "光伏无功", "unit": "kvar" },
          { "label": "ATS 状态", "unit": "" },
          { "label": "ATS 温度", "unit": "℃" }
        ]
      },
      "bindings": {
        "items": [
          {
            "mode": "ts",
            "entity": { "type": "DEVICE", "id": "c27e0b30-528e-11f1-90ba-53cf2ab0fe96", "name": "PDR1_PGC1_METER1" },
            "key": "P"
          },
          {
            "mode": "ts",
            "entity": { "type": "DEVICE", "id": "c27e0b30-528e-11f1-90ba-53cf2ab0fe96", "name": "PDR1_PGC1_METER1" },
            "key": "Q"
          },
          {
            "mode": "ts",
            "entity": { "type": "DEVICE", "id": "c654dcc0-528e-11f1-90ba-53cf2ab0fe96", "name": "PDR4_LP1_ATS1" },
            "key": "switch_state"
          },
          {
            "mode": "ts",
            "entity": { "type": "DEVICE", "id": "c654dcc0-528e-11f1-90ba-53cf2ab0fe96", "name": "PDR4_LP1_ATS1" },
            "key": "temperature"
          }
        ]
      }
    }
  ]
}
